resources/openedge.schema.json

{
  "$schema": "https://json-schema.org/draft/2020-12/schema",
  "$id": "https://riverside-software.fr/openedge-project.json",
  "definitions": {},
  "id": "openedge.json",
  "type": "object",
  "required": [
    "version",
    "charset"
  ],
  "anyOf": [
    { "required": ["artifactId"] },
    { "required": ["name"] }
  ],
  "properties": {
    "groupId": {
      "id": "/properties/groupId",
      "description": "Project group ID",
      "type": "string"
    },
    "artifactId": {
      "id": "/properties/artifactId",
      "description": "Project artifact ID",
      "type": "string"
    },
    "name": {
      "id": "/properties/name",
      "description": "Project name (deprecated, use 'artifactId' instead)",
      "type": "string"
    },
    "version": {
      "id": "/properties/version",
      "description": "Project version",
      "type": "string"
    },
    "defaultProfileDisplayName": {
      "id": "/properties/defaultProfileDisplayName",
      "description": "Default profile display name",
      "type": "string"
    },
    "oeversion": {
      "id": "/properties/oeversion",
      "description": "OpenEdge version for this project",
      "enum": [
        "9.1E",
        "10.2B",
        "11.5",
        "11.6",
        "11.7",
        "12.2",
        "12.4",
        "12.5",
        "12.6",
        "12.7",
        "12.8",
        "13.0",
        "13.1",
        "ESAP"
      ],
      "type": "string"
    },
    "noExtensionBehavior": {
      "id": "/properties/noExtensionBehavior",
      "description": "How files without extension are handled. 'main' means the file is considered a main file, 'include' means it's considered an include file, and '' (empty string) means the file is ignored",
      "enum": [
        "",
        "main",
        "include"
      ],
      "type": "string"
    },
    "commentStyle": {
      "id": "/properties/commentStyle",
      "description": "Comment style used in OpenEdge classes to store documentation. 'javadoc' means the /** */ comment style, 'simple' means the /** */ comment style, and 'consultingwerk' means the /*- */ comment style",
      "type": "string",
      "default": "javadoc",
      "enum": [
        "simple",
        "javadoc",
        "consultingwerk"
      ]
    },
    "charset": {
      "id": "/properties/charset",
      "description": "Charset used by the language server to read source code. Not used by VSCode session.",
      "type": "string"
    },
    "mainFileExtensions": {
      "id": "/properties/mainFileExtensions",
      "description": "List of extensions of OpenEdge main files",
      "items": {
        "type": "string"
      }
    },
    "includeFileExtensions": {
      "id": "/properties/includeFileExtensions",
      "description": "List of extensions of OpenEdge include files",
      "items": {
        "type": "string"
      }
    },
    "graphicalMode": {
      "id": "/properties/graphicalMode",
      "description": "Use prowin or _progres to start OpenEdge sessions",
      "default": false,
      "type": "boolean"
    },
    "extraParameters": {
      "id": "/properties/parameterFiles",
      "description": "Extra parameters passed to Progress executable",
      "type": "string"
    },
    "buildDirectory": {
      "id": "/properties/buildDirectory",
      "description": "Default build directory (if not specified in source directory)",
      "type": "string"
    },
    "preprocessor": {
      "id": "/properties/preprocessor",
      "description": "Custom preprocessor values in Proparse",
      "properties": {
        "opsys": {
          "description": "{&OPSYS} variable and OPSYS function",
          "enum": [
            "windows",
            "unix"
          ],
          "type": "string"
        },
        "windowSystem": {
          "description": "{&WINDOW-SYSTEM} variable",
          "type": "string"
        },
        "proversion": {
          "description": "PROVERSION function",
          "type": "string"
        },
        "batchMode": {
          "description": "{&BATCH-MODE} variable",
          "type": "boolean"
        },
        "processArchitecture": {
          "description": "{&PROCESS-ARCHITECTURE} variable",
          "enum": [
            32,
            64
          ],
          "type": "integer"
        },
        "tokenStartChars": {
          "description": "Comma-separated list of characters that can start function or procedure names. Valid characters are &, /, ^, ;, *, !, #, % and backtick",
          "type": "string"
        }
      }
    },
    "buildPath": {
      "id": "/properties/buildPath",
      "description": "Source and PROPATH entries",
      "items": {
        "type": "object",
        "required": [
          "type",
          "path"
        ],
        "properties": {
          "type": {
            "description": "Entry type",
            "enum": [
              "source",
              "propath",
              "speedscript"
            ],
            "type": "string"
          },
          "path": {
            "description": "Path (relative to root directory). Special value ${DLC} can be used.",
            "type": "string"
          },
          "build": {
            "description": "Optional build directory (absolute path, or relative to root directory). Defaults to buildDirectory",
            "type": "string"
          },
          "xref": {
            "description": "Optional XREF directory (relative to root directory). Defaults to .builder/pct",
            "type": "string"
          },
          "includes": {
            "description": "Only for source entries. Ant-style include patterns (comma-separated list). Defaults to **/*.p,**/*.w,**/*.cls",
            "type": "string"
          },
          "includesFile": {
            "description": "Name of a file; each line of this file is added to the list of files to be included (Ant-style pattern). Mutually exclusive with includes attribute",
            "type": "string"
          },
          "excludes": {
            "description": "Only for source entries. Ant-style exclude patterns (comma-separated list).",
            "type": "string"
          },
          "excludesFile": {
            "description": "Name of a file; each line of this file is added to the list of files to be excluded (Ant-style pattern). Mutually exclusive with excludes attribute",
            "type": "string"
          },
          "documentation": {
            "description": "JSON documentation of classes in this propath entry (use https://wiki.rssw.eu/pct/JsonDocumentation.md PCT task)",
            "type": "string"
          },
          "gen": {
            "description": "Only for speedscript entries. Output directory of e4gl-gen.r (relative to root directory)",
            "type": "string"
          },
          "deployment": {
            "description": "List of directories where to copy rcode (optional)",
            "items": {
              "type": "string"
            }
          }
        }
      },
      "type": "array"
    },
    "procedures": {
      "id": "/properties/procedures",
      "description": "List of startup procedures, executed after DB connections and propath, but before main entry point",
      "items": {
        "type": "object",
        "required": [
          "name",
          "mode"
        ],
        "properties": {
          "name": {
            "description": "Procedure name",
            "type": "string"
          },
          "mode": {
            "description": "RUN mode",
            "enum": [
              "init",
              "once",
              "persistent",
              "super"
            ],
            "type": "string"
          }
        }
      }
    },
    "dbConnections": {
      "id": "/properties/dbConnections",
      "description": "Database connection strings (one DB per entry)",
      "items": {
        "type": "object",
        "required": [
          "name",
          "schemaFile",
          "connect",
          "aliases"
        ],
        "properties": {
          "name": {
            "description": "Database logical name",
            "type": "string"
          },
          "schemaFile": {
            "description": "Database schema file (DF format)",
            "type": "string"
          },
          "connect": {
            "description": "Connection string",
            "type": "string"
          },
          "aliases": {
            "description": "Database aliases",
            "type": "array",
            "items": {
              "type": "string"
            }
          }
        }
      },
      "type": "array"
    },
    "numThreads": {
      "id": "/properties/threads",
      "description": "Number of background worker threads",
      "type": "integer",
      "minimum": 1,
      "maximum": 32
    },
    "profiles": {
      "id": "/properties/profiles",
      "description": "Extra profiles",
      "items": {
        "type": "object",
        "required": [
          "name",
          "value"
        ],
        "properties": {
          "name": {
            "description": "Profile name",
            "type": "string"
          },
          "inherits": {
            "description": "Inherits all values from another quality profile. Use 'default' for main profile. Can be empty.",
            "type": "string"
          },
          "value": {
            "description": "Profile value",
            "type": "object",
            "properties": {
              "oeversion": {
                "id": "/properties/oeversion",
                "description": "OpenEdge version for this project",
                "enum": [
                  "9.1E",
                  "10.2B",
                  "11.5",
                  "11.6",
                  "11.7",
                  "12.2",
                  "12.4",
                  "12.5",
                  "12.6",
                  "12.7",
                  "12.8",
                  "13.0",
                  "13.1",
                  "ESAP"
                ],
                "type": "string"
              },
              "graphicalMode": {
                "id": "/properties/graphicalMode",
                "description": "Use prowin or _progres to start OpenEdge sessions",
                "default": false,
                "type": "boolean"
              },
              "extraParameters": {
                "id": "/properties/parameterFiles",
                "description": "Extra parameters passed to Progress executable",
                "type": "string"
              },
              "buildDirectory": {
                "id": "/properties/buildDirectory",
                "description": "Default build directory (if not specified in source directory). Can be an absolute path, or relative to root directory",
                "type": "string"
              },
              "preprocessor": {
                "id": "/properties/preprocessor",
                "description": "Custom preprocessor values in Proparse",
                "properties": {
                  "opsys": {
                    "description": "{&OPSYS} variable and OPSYS function ('windows' value will return WIN32)",
                    "enum": [
                      "windows",
                      "unix"
                    ],
                    "type": "string"
                  },
                  "windowSystem": {
                    "description": "{&WINDOW-SYSTEM} variable",
                    "type": "string"
                  },
                  "proversion": {
                    "description": "PROVERSION function",
                    "type": "string"
                  },
                  "batchMode": {
                    "description": "{&BATCH-MODE} variable",
                    "type": "boolean"
                  },
                  "processArchitecture": {
                    "description": "{&PROCESS-ARCHITECTURE} variable",
                    "enum": [
                      32,
                      64
                    ],
                    "type": "integer"
                  },
                  "tokenStartChars": {
                    "description": "List of characters (no separator) that can start function or procedure names. Valid characters are &, /, ^, ;, *, !, #, % and backtick.",
                    "type": "string"
                  }
                }
              },
              "buildPath": {
                "id": "/properties/buildPath",
                "description": "Source and PROPATH entries",
                "items": {
                  "type": "object",
                  "required": [
                    "type",
                    "path"
                  ],
                  "properties": {
                    "type": {
                      "description": "Entry type",
                      "enum": [
                        "source",
                        "propath"
                      ],
                      "type": "string"
                    },
                    "path": {
                      "description": "Path (relative to root directory). Special value ${DLC} can be used.",
                      "type": "string"
                    },
                    "build": {
                      "description": "Optional build directory (absolute path, or relative to root directory). Defaults to buildDirectory",
                      "type": "string"
                    },
                    "xref": {
                      "description": "Optional XREF directory (relative to root directory). Defaults to .builder/pct",
                      "type": "string"
                    },
                    "includes": {
                      "description": "Only for source entries. Ant-style include patterns (comma-separated list). Defaults to **/*.p,**/*.w,**/*.cls",
                      "type": "string"
                    },
                    "excludes": {
                      "description": "Only for source entries. Ant-style exclude patterns (comma-separated list).",
                      "type": "string"
                    },
                    "documentation": {
                      "description": "JSON documentation of classes in this propath entry (use https://wiki.rssw.eu/pct/JsonDocumentation.md PCT task)",
                      "type": "string"
                    }
                  }
                },
                "type": "array"
              },
              "dbConnections": {
                "id": "/properties/dbConnections",
                "description": "Database connection strings (one DB per entry)",
                "items": {
                  "type": "object",
                  "required": [
                    "name",
                    "schemaFile",
                    "connect",
                    "aliases"
                  ],
                  "properties": {
                    "name": {
                      "description": "Database logical name",
                      "type": "string"
                    },
                    "schemaFile": {
                      "description": "Database schema file (DF format)",
                      "type": "string"
                    },
                    "connect": {
                      "description": "Connection string",
                      "type": "string"
                    },
                    "aliases": {
                      "description": "Database aliases",
                      "type": "array",
                      "items": {
                        "type": "string"
                      }
                    }
                  }
                },
                "type": "array"
              },
              "numThreads": {
                "id": "/properties/threads",
                "description": "Number of background worker threads",
                "type": "integer",
                "minimum": 1,
                "maximum": 32
              }
            }
          }
        }
      }
    }
  }
}

CHANGELOG.md

* 🐛 Fix excessive memory consumption when new code is created in source directories while language server is online
* ✨ Builtin classes attributes and method signatures now depend on the OE version used in the project (11.7, 12.2, 12.8 and 13.0)
* ✨ Builtin classes documentation per OE version in hover and code completion
* ✨ Hover and code completion on system handles
* ✨ Hover on builtin functions
* ⬆️ ABL-LS 1.23.0-SNAPSHOT
* ⬆️ CABL 3.6.0-SNAPSHOT

* 🚀 Extension now sponsored by Progress!
* ✨ `HideAVMWindow` on OpenEdge 11.x
* ✨ Compilation diagnostics now have location of include files
* ✨ Don't stop Language Server when propath entries can't be read
* ✨ Hover improvements (extent information, static properties / methods, constructors, ...)
* ✨ Code completion improvements (functions, references to static classes, interface properties, ...)
* ✨ ABL log output can be part of compound log
* ✨ Improved debugger startup time
* ✨ Don't specify SAVE INTO directory if identical to source directory (#310)
* ✨ Documentation moved to its own view container
* 🐛 Include files created during the session were not offered in code completion
* 🐛 Fix documentSymbol total failure with incomplete code
* 🐛 Fix LS startup failure when includeFile or excludeFile is empty
* 🐛 Fix PASOE `cont` messages
* 🐛 Recompile classes referenced by interface with changes in property definition
* 🐛 Better error handling when receiving compilation messages + structured error handling in thread.p
* ⬆️ TextMate Grammar 1.3.13
* ⬆️ CABL 3.1.0
* ⬆️ LSP4J 0.24.0
* ⬆️ ABL-LS 1.20.0
* 🚧 Changed single-line comments to multi-lines comments in `thread.p` (pre-11.7 compatibility)

* New `Compile current buffer` action. On untitled buffers, this requires the language to be switched to `ABL` (Ctrl + K, M). Shortcut can be set to Shift + F2 for those willing to mimic procedure editor.
* Fix changeBuildMode action (issue #116)
* New sonarlintProperties attribute in openedge-project.json
* Support for OE 12.8
* Very first version of semantic highlighting (disabled by default)

* Upgrade CABL rules to 2.21.1 (note that if you have a valid CABL subscription, you can execute the CABL rules in VSCode, open the license management website to get your key)
* OpenEdge 12.7 support in configuration files